{
  "$schema": "https://json-schema.org/draft/2020-12/schema",
  "title": "Task",
  "type": "object",
  "additionalProperties": false,
  "required": [
    "object_type",
    "schema_version",
    "task_id",
    "title",
    "status",
    "priority",
    "created_at",
    "updated_at"
  ],
  "properties": {
    "object_type": { "type": "string", "enum": ["task"] },
    "schema_version": { "type": "string", "enum": ["1.0.0"] },
    "task_id": {
      "type": "string",
      "pattern": "^[0-9A-Z]{26}$|^[0-9a-fA-F-]{36}$"
    },
    "title": { "type": "string", "minLength": 1 },
    "status": {
      "type": "string",
      "enum": ["pending", "in_progress", "blocked", "completed", "failed"]
    },
    "priority": { "type": "string", "enum": ["low", "medium", "high", "urgent"] },
    "assignee_id": { "type": "string" },
    "due_at": { "type": "string", "format": "date-time" },
    "summary": { "type": "string" },
    "related_refs": { "type": "array", "items": { "type": "string" } },
    "created_at": { "type": "string", "format": "date-time" },
    "updated_at": { "type": "string", "format": "date-time" },
    "metadata": { "type": "object", "additionalProperties": true }
  }
}
