{
  "object_type": "task",
  "schema_version": "1.0.0",
  "task_id": "01HZXY7Y7Y7E1C1A0Z6P1D6S2G",
  "title": "Review ingestion exceptions",
  "status": "in_progress",
  "priority": "high",
  "assignee_id": "user-2841",
  "due_at": "2025-01-16T17:00:00Z",
  "summary": "Validate and resolve ingestion exceptions flagged overnight.",
  "related_refs": ["workflow-run:01HZXY8Q5GZ07W83T46R6N0P3M"],
  "created_at": "2025-01-15T12:10:00Z",
  "updated_at": "2025-01-15T12:20:00Z",
  "metadata": { "queue": "exceptions" }
}
